{
  "schema": "lubarchy.hardware.inventory/v1",
  "system": {
    "architecture": "amd64",
    "kernel_release": "6.12.0-fixture-amd64",
    "boot_firmware": "uefi",
    "secure_boot": "disabled",
    "virtualization": {
      "kind": "none"
    }
  },
  "cpu": {
    "architecture": "x86_64",
    "vendor": "AuthenticAMD",
    "family": 25,
    "model": 250,
    "stepping": 0,
    "model_name": "Synthetic AMD fixture CPU",
    "microcode_revision": "0xa0000f0"
  },
  "devices": [
    {
      "id": "pci:0000:02:00.0",
      "bus": "pci",
      "locator": "0000:02:00.0",
      "vendor_id": "10ec",
      "device_id": "f006",
      "subsystem_vendor_id": "10ec",
      "subsystem_device_id": "f106",
      "class_id": "020000",
      "modalias": "pci:v000010ECd0000F006sv000010ECsd0000F106bc02sc00i00",
      "driver": "r8169",
      "modules": [
        "r8169"
      ]
    },
    {
      "id": "pci:0000:03:00.0",
      "bus": "pci",
      "locator": "0000:03:00.0",
      "vendor_id": "8086",
      "device_id": "f007",
      "subsystem_vendor_id": "8086",
      "subsystem_device_id": "f107",
      "class_id": "028000",
      "modalias": "pci:v00008086d0000F007sv00008086sd0000F107bc02sc80i00",
      "driver": "iwlwifi",
      "modules": [
        "iwlwifi"
      ]
    }
  ]
}
