{
  "schema": "lubarchy.hardware.inventory/v1",
  "system": {
    "architecture": "amd64",
    "kernel_release": "6.12.0-fixture-amd64",
    "boot_firmware": "uefi",
    "secure_boot": "disabled",
    "virtualization": {
      "kind": "none"
    }
  },
  "cpu": {
    "architecture": "x86_64",
    "vendor": "GenuineIntel",
    "model_name": "Synthetic firmware fixture CPU"
  },
  "devices": [
    {
      "id": "pci:0000:03:00.0",
      "bus": "pci",
      "locator": "0000:03:00.0",
      "vendor_id": "8086",
      "device_id": "0082",
      "subsystem_vendor_id": "f0e0",
      "subsystem_device_id": "1301",
      "class_id": "028000",
      "modalias": "pci:v00008086d00000082sv0000F0E0sd00001301bc02sc80i00",
      "driver": "iwlwifi"
    }
  ]
}
