{
  "schema": "lubarchy.hardware.inventory/v1",
  "system": {
    "architecture": "amd64",
    "kernel_release": "6.12.0-fixture-amd64",
    "boot_firmware": "uefi",
    "secure_boot": "disabled",
    "virtualization": {
      "kind": "none"
    }
  },
  "cpu": {
    "architecture": "x86_64",
    "vendor": "SyntheticCPU",
    "model_name": "Synthetic unknown-vendor fixture CPU"
  },
  "devices": [
    {
      "id": "pci:0000:05:00.0",
      "bus": "pci",
      "locator": "0000:05:00.0",
      "vendor_id": "f0ff",
      "device_id": "f0ff",
      "subsystem_vendor_id": "f0ff",
      "subsystem_device_id": "f1ff",
      "class_id": "ff0000",
      "modalias": "pci:v0000F0FFd0000F0FFsv0000F0FFsd0000F1FFbcFFsc00i00"
    }
  ]
}
